### DISCUSSION TITLE
android не подключается приложение телеграма

### DISCUSSION THREAD

**Discussion by ML35** [bivlked/amneziawg-installer#224] [General]
Конфиг сервера с зажатым MTU для мобильных

cat /etc/amnezia/amneziawg/awg0.conf
[Interface]
PrivateKey = aхххх
Address = 10.9.9.1/24
MTU = 1200
ListenPort = 39743
PostUp = iptables -I FORWARD -i %i -j ACCEPT; iptables -t nat -A POSTROUTING -o ens1 -j MASQUERADE
PostDown = iptables -D FORWARD -i %i -j ACCEPT; iptables -t nat -D POSTROUTING -o ens1 -j MASQUERADE
Jc = 3
Jmin = 40
Jmax = 70
S1 = 36
S2 = 130
S3 = 12
S4 = 14
H1 = 24621968-255528135
H2 = 600193065-974788294
H3 = 1161195401-1614562219
H4 = 1639654630-1856014861
I1 = <r 64>

Раздельное туннелирование только на сервере. Браузер открывает ОК прекрасно все ютубы и что хочешь, приложение телеги висит или в соединении или в загрузке картинок вечной. Трафик внутри тоннеля я вижу:

23:23:49.190912 IP (tos 0x28, ttl 51, id 60082, offset 0, flags [DF], proto TCP (6), length 230) 149.154.167.50.https > 10.9.9.2.60952: Flags [P.], cksum 0xd552 (correct), seq 1:179, ack 531, win 2082, options [nop,nop,TS val 1190339535 ecr 630978180], length 178

Есть предположения что происходит? Клиенты обновлял до последних, серверную часть тоже

awg --version
amneziawg-tools v3.1.20260812 - https://amnezia.org
5.0.0.5 - версия андроид клиента

**Comment by bivlked** [comment]
Привет. Начну с просьбы, без неё дальше только гадания: покажите секцию `[Interface]` клиентского конфига, оттуда нужны строки `MTU` и `AllowedIPs`. Серверный вы прислали, а решает тут пара.

Из вашего дампа кое-что видно уже сейчас. Дата-центр телеграма прислал 178 байт полезной нагрузки и подтвердил принятые от вас 530. Сколькими пакетами эти 530 ушли, из одной строки не понять, так что далеко идущих выводов не делаю, но факт остаётся: обмен в обе стороны идёт, соединение живое. А значит связь как таковая есть, и спотыкается что-то более узкое.

Проверка на минуту, полезная при любом ответе. Впишите клиенту `MTU = 1100`: в файле это секция `[Interface]`, в приложении соответствующее поле в настройках подключения. Переподключитесь и откройте в телеграме картинку. Пошла, значит дело в размере пакетов, и дальше понятно, что чинить. Не пошла, значит версия сильно слабеет, хотя совсем её и не хоронит.

Почему думаю на размер. В `PostUp` у вас нет правил, подрезающих MSS:

```
iptables -t mangle -A FORWARD -o %i -p tcp --tcp-flags SYN,RST SYN -j TCPMSS --set-mss 1160
iptables -t mangle -A FORWARD -i %i -p tcp --tcp-flags SYN,RST SYN -j TCPMSS --set-mss 1160
```

Установщик добавляет их с версии 5.17.0, значение берёт как `MTU` минус 40, у вас при `MTU = 1200` это 1160. Они переписывают размер сегмента при открытии соединения, чтобы стороны не договорились о том, что в туннель не влезет. Ломается это обычно на обратном пути: пакет приходит от дата-центра на `ens1`, а при выходе через `awg0` не помещается в 1200. Сервер его не пропускает и шлёт отправителю ICMP «нужна фрагментация», но такие ICMP по дороге часто режут, и отправитель не узнаёт, что надо уменьшить размер.

Но сразу скажу, где версия слабая, чтобы вы не чинили вслепую. Если у клиента `MTU` тоже 1200, он и сам объявит 1160, и подрезать будет нечего: правила ничего не изменят. Причём если конфиг вам выдал не самый старый установщик, клиент серверный `MTU` наследует, то есть 1200 там весьма вероятны. Версия работает в другом случае: когда клиентский `MTU` больше серверного или его нет вовсе и клиент считает сам. Вот почему я и прошу клиентский конфиг первым делом.

Если проверка с `MTU = 1100` поможет, лечить лучше на сервере. Допишите оба правила в конец `PostUp`, зеркальные им с `-D` вместо `-A` в конец `PostDown`, и перезапустите сервис:

```bash
systemctl restart awg-quick@awg0
```

Перед правкой сделайте копию `awg0.conf`. Опечатка в `PostUp` уронит интерфейс при старте, да и сам перезапуск рвёт все текущие подключения, так что если вы ходите на сервер по SSH через туннель, делайте это с прямого адреса.

Про `--force` знаю, что подумаете, поэтому отговорю сразу: он пересоберёт конфиг с этими правилами, но это полная переустановка минут на двадцать, с обновлением системы, возможной перезагрузкой и повторным прогоном фаервола. Ради двух строк не стоит.

Почему браузер при этом не страдает, честно говоря, не скажу. Напрашивается объяснение через QUIC, но у ютуба хватает и обычного TCP, так что доказательством это не будет, а гадать не хочу.

IPv6 ставлю ниже, но не вычёркиваю. В режиме по умолчанию `AllowedIPs` его действительно не перечисляет. Против версии то, что вместе с телеграмом отвалился бы и ютуб, а он у вас открывается. За неё то, что приложения выбирают адреса и протоколы по-разному, так что избирательная утечка возможна. Строка `AllowedIPs` из клиентского конфига закроет и этот вопрос.

Отдельно, не по теме: в `PostUp` нет правила изоляции клиентов, оно появилось в 5.20.0. Видят ли ваши клиенты друг друга на самом деле, зависит ещё и от их `AllowedIPs`, но принудительной изоляции на сервере сейчас нет.

---

**Дополнение от 2 сентября 2026.**

С версии 5.31.0 установщик выдаёт `::/0` и в режиме по умолчанию, поэтому фраза выше про «в режиме по умолчанию `AllowedIPs` его не перечисляет» описывает конфиги, где `::/0` нет - посмотреть можно прямо в строке `AllowedIPs` клиентского файла.

Если `::/0` там появился, версия про избирательную утечку по IPv6 отпадает: такой трафик уходит в туннель и гаснет, а приложения с обычным fallback переключаются на IPv4. Чтобы получить такой профиль на существующем сервере, нужен сервер на 5.31.0, перевыпуск клиента (`regen <имя>`) и переимпорт файла - после импорта стоит убедиться, что `::/0` виден именно в активном профиле, некоторые клиенты создают дубль вместо замены.

Цена, чтобы знать заранее: пока VPN включён, ресурсы, доступные только по IPv6, недоступны, и локальная сеть по IPv6 тоже перестаёт отвечать. По IPv4 она остаётся доступной.

**Reply by ML35** [reply]
Привет. Спасибо за отзыв. Перераскатил SCRIPT_VERSION="5.27.0" с параметрами install_amneziawg.sh --preset=mobile --yes --route-amnezia --force и что-то вообще все сломалось.
Соединение есть, значок connected загорается, вижу трафик на внешнем интерфейсе:

20:59:43.558726 IP 128-71-91-100.broadband.corbina.ru.9941 > 43.245.x.x.https: UDP, length 46
20:59:43.558730 IP 128-71-91-100.broadband.corbina.ru.9941 > 43.245.x.x.https: UDP, length 54
20:59:43.558731 IP 128-71-91-100.broadband.corbina.ru.9941 > 43.245.x.x.https: UDP, length 57
20:59:43.558732 IP 128-71-91-100.broadband.corbina.ru.9941 > 43.245.x.x.https: UDP, length 184
20:59:43.559064 IP 128-71-91-100.broadband.corbina.ru.9941 > 43.245.x.x.https: UDP, length 64
20:59:43.560206 IP 43.245.x.x.https > 128-71-91-100.broadband.corbina.ru.9941: UDP, length 222

но внутри тоннеля tcpdump  ничего не видит. портом игрался после того, как дефолтовый не заработал. 
меня еще смутило, что ядро новое подтянулось 6.12, debian13

Пары сервер-конфиг:

cat /etc/amnezia/amneziawg/awg0.conf
[Interface]
PrivateKey = aххх
Address = 10.9.9.1/24
MTU = 1280
ListenPort = 443
PostUp = iptables -I FORWARD -i %i -j ACCEPT; iptables -t nat -A POSTROUTING -o ens1 -j MASQUERADE; iptables -t mangle -A FORWARD -o %i -p tcp --tcp-flags SYN,RST SYN -j TCPMSS --set-mss 1240; iptables -t mangle -A FORWARD -i %i -p tcp --tcp-flags SYN,RST SYN -j TCPMSS --set-mss 1240; while iptables -D FORWARD -i %i -o %i -j DROP 2>/dev/null; do :; done; iptables -I FORWARD -i %i -o %i -j DROP
PostDown = iptables -D FORWARD -i %i -j ACCEPT; iptables -t nat -D POSTROUTING -o ens1 -j MASQUERADE; iptables -t mangle -D FORWARD -o %i -p tcp --tcp-flags SYN,RST SYN -j TCPMSS --set-mss 1240; iptables -t mangle -D FORWARD -i %i -p tcp --tcp-flags SYN,RST SYN -j TCPMSS --set-mss 1240; iptables -D FORWARD -i %i -o %i -j DROP 2>/dev/null || true
Jc = 3
Jmin = 40
Jmax = 70
S1 = 36
S2 = 130
S3 = 12
S4 = 14
H1 = 678021312-1213671565
H2 = 1561491960-1836791498
H3 = 1894251131-2019529772
H4 = 2062531211-2109874434
I1 = <r 64>

[Peer]
#_Name = my_phone
PublicKey = Uххх
AllowedIPs = 10.9.9.2/32

cat my_phone.conf
[Interface]
PrivateKey = 0x
Address = 10.9.9.2/32
DNS = 1.1.1.1,1.0.0.1
MTU = 1280
Jc = 3
Jmin = 40
Jmax = 70
S1 = 36
S2 = 130
S3 = 12
S4 = 14
H1 = 678021312-1213671565
H2 = 1561491960-1836791498
H3 = 1894251131-2019529772
H4 = 2062531211-2109874434
I1 = <r 64>

[Peer]
PublicKey = Kхх
Endpoint = 43.245.x.x:443
AllowedIPs = 0.0.0.0/5,8.0.0.0/7,11.0.0.0/8,12.0.0.0/6,16.0.0.0/4,32.0.0.0/3,64.0.0.0/2,128.0.0.0/3,160.0.0.0/5,168.0.0.0/6,172.0.0.0/12,172.32.0.0/11,172.64.0.0/10,172.128.0.0/9,173.0.0.0/8,174.0.0.0/7,176.0.0.0/4,192.0.0.0/9,192.128.0.0/11,192.160.0.0/13,192.169.0.0/16,192.170.0.0/15,192.172.0.0/14,192.176.0.0/12,192.192.0.0/10,193.0.0.0/8,194.0.0.0/7,196.0.0.0/6,200.0.0.0/5,208.0.0.0/4,8.8.8.8/32,1.1.1.1/32
PersistentKeepalive = 33

PS меня что-то смущают нематчащиеся ключи pub+priv в серверном и клиентском конфиге, хотя регенил.

**Reply by bivlked** [reply]
Привет. Начну с хорошего: сервер вас слышит и отвечает, и ключи в порядке - это видно прямо из вашего дампа. Значок горит, а интернета нет, значит ломается дальше. Туда и смотрел, там нашлось одно расхождение.

Сначала дамп, раз в нём и лежит ответ на ваш постскриптум. Шесть пакетов за полторы миллисекунды читаются так:

```
46, 54, 57  - мусорные пакеты: Jc = 3 штуки размером от Jmin = 40 до Jmax = 70
184         - рукопожатие: 148 байт WireGuard + ваш S1 = 36
64          - маскирующий пакет, I1 = <r 64>
222         - ответ на рукопожатие: 92 байта + ваш S2 = 130
```

Важен размер ответа, а не сам факт ответа. Ответить сервер может и не разобравшись, чей ключ пришёл: под нагрузкой AmneziaWG отвечает cookie reply, ещё не расшифровав запрос и не посмотрев, есть ли у него такой пир. Но cookie reply весил бы 64 плюс `S3 = 12`, а это 76 байт, тогда как пришло 222. Это полноценный ответ на рукопожатие, а его сервер формирует, только когда расшифровал запрос и нашёл у себя такого пира. Ваш ключ он узнал.

Одна поправка к сказанному: дамп снят на сервере, поэтому доказывает, что ответ ушёл, а не что телефон его принял. Значок `connected` в приложении тоже загорается по поднятому туннелю, а не по рукопожатию. Точно скажет только `awg show`, к нему вернусь.

А смущает вас, думаю, вот что: в серверном `[Peer]` лежит публичный ключ КЛИЕНТА, а в клиентском `[Peer]` - публичный ключ СЕРВЕРА. Это разные ключи, и совпадать они не должны. Сверяются так:

```bash
awg show awg0 public-key                                  # = [Peer] PublicKey в клиентском конфиге
echo '<PrivateKey из клиентского конфига>' | awg pubkey    # = [Peer] PublicKey в серверном конфиге
```

## Старый список AllowedIPs у клиента

5.27.0 в режиме `--route-amnezia` начинает список с `1.0.0.0/8, 2.0.0.0/7, 4.0.0.0/6`. У вас он начинается с `0.0.0.0/5`, а дальше, с `8.0.0.0/7`, совпадает элемент в элемент. Это тот же список, но в редакции до версии 5.16.1.

`0.0.0.0/5` захватывает служебный блок `0.0.0.0/8`. На нём спотыкается iOS: туннель поднимается, а через несколько секунд трафик встаёт (Issue #42). С 5.16.1 тот же охват набирается тремя подсетями, мимо нулевого блока.

Как он у вас уцелел через переустановку. Уже существующих клиентов установщик не трогает, а `regen` читает `AllowedIPs` из клиентского файла и пишет обратно прочитанное. Старый список переживает обе операции. Проверяется одной командой:

```bash
grep "уже существует" /root/awg/install_amneziawg.log
```

Если строка есть, объяснение сходится. И это мой недосмотр, а не ваш: флаг `--route-amnezia` до уже выданных конфигов не доходит и молчит об этом. Заведу отдельно и поправлю.

Не хочу выдавать это за диагноз. Про iOS известно точно, там на этом блоке ловили обрыв и чинили. Про Android замеров у меня нет, так что версия, а не факт. Но из присланных параметров это единственное, что уверенно расходится с тем, что должна была выдать 5.27.0.

**Проверка, она же и починка.** В клиентском конфиге замените ТОЛЬКО первый элемент, остальное не трогайте:

```
было:  AllowedIPs = 0.0.0.0/5,8.0.0.0/7,11.0.0.0/8,...
стало: AllowedIPs = 1.0.0.0/8,2.0.0.0/7,4.0.0.0/6,8.0.0.0/7,11.0.0.0/8,...
```

Править надо тот конфиг, который стоит на телефоне: правка файла на сервере сама на устройство не переедет. Если приложение даёт редактировать туннель, поправьте строку там, иначе просто залейте исправленный конфиг заново.

Переподключитесь. Из охвата при этом уходит ровно один блок, `0.0.0.0/8`, который и так не маршрутизируется, поэтому если заработало, дело точно в первом элементе старого списка.

Не помогло - попробуйте временно `AllowedIPs = 0.0.0.0/0`. Эта проба добавляет и всё, что `--route-amnezia` исключает намеренно, поэтому назовёт не причину, а только направление: дело в маршрутизации на клиенте. Если возиться с файлом не хочется, перевыпустите клиента, новый конфиг соберётся уже с правильным списком:

```bash
/root/awg/manage_amneziawg.sh remove my_phone
/root/awg/manage_amneziawg.sh add my_phone
```

Ещё про метод замера. `tcpdump -i awg0` показывает только расшифрованные пакеты, а keepalive полезной нагрузки не несёт. При `PersistentKeepalive = 33` тридцать три секунды простоя дают ноль строк на совершенно живом туннеле, так что снимать надо, пока телефон реально что-то грузит. И не пингуйте с телефона `10.9.9.1`: режим `--route-amnezia` это публичный IPv4 без приватных диапазонов, а `10.0.0.0/8` приватный, в вашем списке его нет, и телефон такой пакет в туннель просто не отправит. Тишина в ответ тут ничего не доказывает.

## Что прислать дальше

Вывод `awg show` на сервере, снятый в момент, когда телефон подключён и вы пытаетесь открыть страницу. Ключи затрите, нужны `latest handshake` и `transfer`:

- `received` не растёт, хотя вы грузите страницу - пользовательский трафик до сервера не доходит;
- `received` растёт синхронно с попытками - доходит, и дальше по цепочке: `tcpdump -i awg0`, форвардинг, NAT, внешний интерфейс;
- `latest handshake` каждый раз моложе нескольких секунд - рукопожатия идут ненормально часто, причин тут может быть много, включая банальные переподключения самого приложения.

Первый случай самый интересный, потому что кандидатов в нём два: либо клиент не заворачивает трафик в туннель (это как раз про список выше), либо путь до сервера душат уже после рукопожатия. Разделяются они за минуту: поднимите тот же конфиг из другой сети, раздайте интернет с телефона другого оператора. Заработало - режут путь, а не конфиг, и тогда смотреть сюда: [фильтрация по AS хостера](https://github.com/bivlked/amneziawg-installer/blob/main/ADVANCED.md#as-blocking-adv). От неё `Jc`/`Jmin`/`Jmax` не спасают, потому что меняют вид пакета, а не его адресата; там же разобран `I1`, замаскированный под настоящий протокол, вместо бесструктурного `<r 64>`, который стоит у вас.

**На что не надо отвлекаться.** Список записан без пробелов после запятых - косметический дефект 5.27.0, поправлен в 5.27.1, обе формы читаются одинаково. Порт трогать пока незачем: ваши пакеты на 443/udp до сервера доходят, и он на них отвечает. Ядро 6.12 на Debian 13 само по себе не подозрительно, под новое ядро модуль пересобирает DKMS, а с 5.12.0 за этим следит ещё и юнит `amneziawg-ensure-module`. Гарантии это не даёт, всё упирается в заголовки ядра и в то, что сборка прошла, поэтому проверяйте по факту:

```bash
cat /sys/module/amneziawg/version
```

Файла нет - модуль не загружен. Но раз рукопожатие обрабатывается, он загружен, и версию заодно видно.

И про прошлый раз. Правила MSS, которых в вашем конфиге не было, установщик теперь поставил сам (`--set-mss 1240` при `MTU = 1280`), так что моя тогдашняя версия отпала - её закрыла переустановка. Заодно учтите, что симптом сменился: начинали с «телега висит, браузер работает», сейчас не работает ничего. Сначала вернём трафик, а потом уже посмотрим, осталась ли та, первая проблема.

**Reply by bivlked** [reply]
Поправка к моему предыдущему ответу, и поправка существенная.

Я написал, что флаг `--route-amnezia` до уже выданных конфигов не доходит и молчит об этом. Первая половина верна, вторая нет: установщик предупреждает и прямо называет команду. Загляните в свой лог:

```bash
grep -A1 "Режим маршрутизации изменён" /root/awg/install_amneziawg.log
```

Там должно быть так:

```
WARN: Режим маршрутизации изменён. Существующие клиентские конфиги сохраняют старые AllowedIPs.
WARN: Применить новый режим ко всем клиентам: sudo bash /root/awg/manage_amneziawg.sh regen --reset-routes
```

Эта команда делает то, что я предлагал делать руками, и вам хватит её одной. Раз вы ставили с `--route-amnezia`, актуальный список уже лежит в настройках установки, осталось разложить его по клиентам:

```bash
sudo bash /root/awg/manage_amneziawg.sh regen --reset-routes
```

Проверил на стенде, а не по исходникам, потому что ошибся я как раз на исходниках. Взял установку, вписал в неё старый список, прогнал команду: `AllowedIPs` у клиентов сменился с `0.0.0.0/5, ...` на `1.0.0.0/8, 2.0.0.0/7, 4.0.0.0/6, ...`, ключи остались прежними (сверял хеш приватного до и после), туннель при этом не падал.

Про ключи отдельно: пир на сервере остаётся тем же, перевыпускать и заново заводить клиента не нужно. А вот забрать обновлённый конфиг на телефон всё равно придётся, на сервере файл поправится, а копия на устройстве нет.

Если вы уже поправили первый элемент вручную, переделывать ничего не надо, результат тот же.

Остальное в силе, жду `awg show` во время попытки загрузки.

**Reply by ML35** [reply]
да, выхлоп 
`grep -A1 "Режим маршрутизации изменён" /root/awg/install_amneziawg.log
[2026-08-21 00:02:59] WARN: Режим маршрутизации изменён. Существующие клиентские конфиги сохраняют старые AllowedIPs.
[2026-08-21 00:02:59] WARN: Применить новый режим ко всем клиентам: sudo bash /root/awg/manage_amneziawg.sh regen --reset-routes
--
[2026-08-21 00:05:59] WARN: Режим маршрутизации изменён. Существующие клиентские конфиги сохраняют старые AllowedIPs.
[2026-08-21 00:05:59] WARN: Применить новый режим ко всем клиентам: sudo bash /root/awg/manage_amneziawg.sh regen --reset-routes
--
[2026-08-21 00:09:26] WARN: Режим маршрутизации изменён. Существующие клиентские конфиги сохраняют старые AllowedIPs.
[2026-08-21 00:09:26] WARN: Применить новый режим ко всем клиентам: sudo bash /root/awg/manage_amneziawg.sh regen --reset-routes`

после regen --reset-routes все починилось, дополнительно с MTU = 1100

Дискуссию закрою, спасибо большое, все заработало!

**Reply by bivlked** [reply]
Отлично, что заработало. И спасибо, что вернулись с результатом: обычно человек просто пропадает, и тред остаётся висеть без развязки. Выхлоп лога тоже пригодился, причём не так, как вы думаете.

Для тех, кто найдёт тред потом, коротко суть. Если переустановить AmneziaWG с другим режимом маршрутизации (здесь это был `--route-amnezia`), уже выданные клиентские конфиги сохраняют старый список `AllowedIPs`. Снаружи это выглядит так: клиент подключается, значок горит, пакеты на внешнем интерфейсе видно, а внутри туннеля пусто. Лечится одной командой:

```bash
sudo bash /root/awg/manage_amneziawg.sh regen --reset-routes
```

Перевыпускать клиента при этом не надо, ключи и пир остаются прежними. А вот обновлённый конфиг с сервера на устройство придётся забрать заново, сам он туда не переедет.

## Про `MTU = 1100`, если захотите вернуть скорость

Вы поменяли две вещи разом, так что какая из них вылечила именно телеграм, пока непонятно. Проверяется это за минуту, и заодно с пользой.

Когда вы писали в первый раз, у вас стоял `MTU = 1200` и ни одного правила MSS в `PostUp`. Переустановка их поставила сама, `--set-mss 1240`. То есть у проблемы с размером пакетов теперь есть лечение поаккуратнее, и зажимать MTU до 1100 может быть уже незачем.

Попробуйте вернуть клиенту `MTU = 1280`, как в серверном конфиге, и откройте в телеграме картинку. Пошла - оставляйте: каждый пакет повезёт на 180 байт полезных данных больше, на загрузке медиа это заметно. Начнёт виснуть - вернёте 1100, потеряете минуту. Заодно и узнаем, что лечило: если на 1280 всё хорошо, дело было в отсутствии правил MSS, а не в самом MTU.

Не хочется трогать работающее - и не трогайте, 1100 ничего не ломает, просто медленнее.

## Ваш лог показал дефект, которого я не видел

Предупреждение про смену режима у вас в логе есть, причём трижды. Вы его всё равно не увидели, и я вас понимаю.

Печатается оно на самом первом шаге, когда установщик только сохраняет параметры. А установка идёт в три захода с двумя перезагрузками между ними, и в каждом заходе эти две строчки снова уезжают вверх под вывод apt. Отсюда и три штуки у вас в логе. Читают-то обычно финальный отчёт, а в нём про смену режима нет ни слова.

Значит дело не в формулировке, а в месте. Продублирую в финальный отчёт, туда, где на экран действительно смотрят. Заодно и соседний случай, смену изоляции клиентов: там ровно то же место и ровно та же судьба.

Без вашего вывода я бы так и считал, что раз предупреждение написано, то этого достаточно.

Закрывайте, конечно. Если телеграм снова начнёт капризничать, пишите.

**Reply by ML35** [reply]
>Предупреждение про смену режима у вас в логе есть, причём трижды. Вы его всё равно не увидели, и я вас понимаю.
>Без вашего вывода я бы так и считал, что раз предупреждение написано, то этого достаточно.

тут наверное стоит пересмотреть в целом систему логирования, ее очень много. в stdout как будто достаточно писать базовый ОК и ошибки, в лог детально

>Попробуйте вернуть клиенту MTU = 1280

поиграюсь попозжее, на днях

**Reply by bivlked** [reply]
Замечание про логи по делу, и доказывает его ваш же случай: предупреждение про смену режима попалось в логе трижды и всё равно прошло мимо. Значит дело не в том, что я о чём-то умолчал.

Но механизм, который вы предлагаете, наполовину уже работает, и не спасает. Предупреждения и ошибки идут в stderr, обычные сообщения в stdout, в файл пишется всё. В терминале это ничего не меняет: оба потока рисуются на одном экране вперемешку, и предупреждение тонет среди обычных строк ровно так же, как если бы разделения не было. Для масштаба: в коде установщика 252 обычных сообщения и 159 предупреждений.

Так что резать вывод, по-моему, не тот рычаг. Настоящий в том, чтобы всё, что требует ваших рук, доживало до конца установки. В финальном отчёте сейчас есть, куда положены файлы и какие команды пригодятся, а блока «что осталось сделать вручную» нет. Будь он там, `regen --reset-routes`, та самая команда, которая в итоге всё и вылечила, оказалась бы последней строкой на экране, а не одной из сотен где-то в середине.

Осложнение тут одно: установщик перезагружает сервер дважды, поэтому копить список в памяти бессмысленно, придётся складывать его в файл рядом с состоянием установки.

Записал как задачу. Если будут ещё наблюдения такого рода, пишите: изнутри своя простыня вывода простынёй не выглядит, такое видно только снаружи.

Про `MTU` разбирайтесь без спешки. Если дойдут руки, интересен один факт: пойдёт ли телеграм на `1280` теперь, когда правило MSS стоит на сервере. Это покажет, был ли зажим до `1100` нужен по существу или просто прикрывал ту же проблему с другой стороны.

**Comment by ML35** [comment]
возвращаюсь с ответом. хоть и поздно. чистый инсталл даже без пресета --mobile заработал прекрасно. видимо мир шире, чем мы думали.

**Comment by ML35** [comment]
так. стоп, ящик водки и всех обратно. медиа все еще не грузится. пошел в реинсталл с --mobile

**Comment by ML35** [comment]
с --mobile заработало из коробки

**Reply by bivlked** [reply]
@ML35, спасибо, что отписались, и отдельно за сообщение про откат: без него тред закончился бы на неверном выводе.

Флаг `--mobile` меняет две вещи: ставит порт `443/udp` вместо стандартного `39743` и включает пресет `mobile`, в котором мусорных пакетов меньше и они короче. Мусорные пакеты уходят только перед рукопожатием, а картинки в Telegram грузятся уже после него. Так что, скорее всего, помог порт: некоторые операторы режут UDP на нестандартных портах, а `443/udp` похож на обычный QUIC. Наверняка сказать нельзя, вы поменяли обе вещи сразу.

Первая установка тоже поначалу казалась рабочей. Если через день-два картинки снова перестанут грузиться, напишите сюда.

И если не трудно: картинки не грузились через мобильный интернет или через Wi-Fi, и какой оператор? По таким ответам видно, где хватает обычной установки, а где нужен `--mobile`.

**Reply by ML35** [reply]
мобильный, билайн-мск
