### DISCUSSION TITLE
Прошу помощи. Не подключается клиент. Нет рукопожатия хотя всё делал по инструкции.

### DISCUSSION THREAD

**Discussion by Craiver** [bivlked/amneziawg-installer#153] [Q&A]
Если что, я чайник. Могу чего то элементарного не понимать.
Клиент 4.8.19.0
хост rdp-onedash.ru. Порт для ssh использует 9714, хотя вроде это не важно.
Статус и фаервол вроде как в норме.
Менял операторов и wifi сети. 
Пробовал переустановить сервер с пресетом --preset=mobile. Не помогло.
Еще не скачивается qr код ssh: connect to host 150.251.145.6 port 22: Connection timed out. Может проблема общая?
Куда посмотреть? Что проверить?
P.S. прошу указать полные команды.

**Comment by bivlked** [comment]
Привет. Давай спокойно, по шагам. Похоже, дело не в самом AmneziaWG, а в том, что до сервера трафик не доходит.

Ты пишешь, что QR не качается и `ssh ... port 22: Connection timed out` на 150.251.145.6 (порт ты вроде сменил на 9714). Вот это и есть главный симптом: если до сервера не достучаться, VPN на нём не поднимется, сколько операторов ни перебирай. Так что начнём с сервера.

1. Проверь, доступен ли он вообще - с другого устройства или из другой сети: `ping 150.251.145.6` и SSH на свой порт: `ssh -p 9714 root@150.251.145.6`. Если SSH не идёт - сначала разбираемся с этим (файрвол у хостера, тот ли порт, запущен ли сервер).
2. Клиент и QR. Лёгкому `AmneziaWG` (это который amneziawg-android) нужен обычный конфиг-QR (`.png`) или файл `.conf`; полный AmneziaVPN берёт `vpn://`-QR. Их легко перепутать, и тогда как раз "нет рукопожатия".
3. На сервере глянь, доходят ли попытки: `sudo bash /root/awg/manage_amneziawg.sh show` и `awg show awg0` - есть ли что-то от клиента.

`--preset=mobile` и смена Wi-Fi тут не помогут, пока трафик до сервера не доходит. Сделай пункт 1 и напиши, что вышло - дальше подскажу точнее.

**Reply by Craiver** [reply]
1. На другом устройстве пингуется. и SSH тоже подключается.
2. Понял ошибку. Но AmneziaVPN для windows тоже не подключилась  через vpn://
3. Нет попыток. Ничего не доходит.

scp -P 9714 root@150.251.145.6:/root/awg/my_phone.png . тоже пробовал с таким же результатом.
Порты открыты
Status: active
Logging: on (low)
Default: deny (incoming), allow (outgoing), deny (routed)
New profiles: skip

To                         Action      From
--                         ------      ----
22/tcp                     LIMIT IN    Anywhere                   # SSH Rate Limit
9714                       ALLOW IN    Anywhere
9714/tcp                   ALLOW IN    Anywhere
39743/udp                  ALLOW IN    Anywhere                   # AmneziaWG VPN
22/tcp (v6)                LIMIT IN    Anywhere (v6)              # SSH Rate Limit
39743/udp (v6)             ALLOW IN    Anywhere (v6)              # AmneziaWG VPN
9714 (v6)                  ALLOW IN    Anywhere (v6)
9714/tcp (v6)              ALLOW IN    Anywhere (v6)

Anywhere on eth0           ALLOW FWD   Anywhere on awg0           # AmneziaWG Routing
Anywhere (v6) on eth0      ALLOW FWD   Anywhere (v6) on awg0      # AmneziaWG Routing

**Reply by bivlked** [reply]
Хорошая новость: полдела сделано. С другого устройства сервер и пингуется, и по SSH пускает - значит он живой и сеть до него есть. Проблема не на сервере, а в пути от твоего основного устройства.

Смотри: с него не проходит вообще ничего - ни SSH на 9714, ни scp, ни vpn://, а с другого всё ок. Раз рубится даже SSH, дело не в VPN, а в сети или в самом устройстве. Два направления: либо твоя сеть (роутер, провайдер) режет этот сервер, либо на устройстве мешает антивирус, другой включённый VPN или прокси.

Проверь так:
1. С проблемного устройства ткни именно в порт, а не пингом (ICMP могут резать отдельно). На Windows: `Test-NetConnection 150.251.145.6 -Port 9714`. Таймаут при том, что с другого устройства порт открыт, - значит режется у тебя.
2. Раздай интернет с телефона и попробуй с этого же устройства через хотспот. Заработало - виноват домашний провайдер или роутер (бывает, блокируют целую подсеть хостера). Не заработало - копай на устройстве: firewall, антивирус, лишний VPN.

Напиши, где отвалилось (дом или мобильный, какой провайдер, есть ли на устройстве VPN или антивирус) - подскажу дальше. Сервер не трогай, он отвечает.

**Reply by Craiver** [reply]
Частично разобрался. 22 порт блокировали и хостинг и провайдер. 
Теперь другая проблема. Клиент подключился, хэндшейк есть по логам, но трафик не идет. Провайдер МТС. Операторов пробовал МТС, Ёта, Сбермобайл.

**Reply by bivlked** [reply]
С портом разобрался - уже полдела, дальше проще.

Сразу зацепка: раз одинаково не идёт на трёх операторах (МТС, Ёта, Сбермобайл), это почти наверняка не оператор, а конфиг или сервер. И раз хендшейк проходит - обфускация с версиями ни при чём, они бы его и не дали. Значит теряется уже сам трафик, а это ловится в пару шагов.

1. На сервере, пока клиент подключён:

```
awg show
```

Смотри transfer у своего клиента: received - принято от него, sent - отдано ему. Растёт received, а sent почти ноль - клиент шлёт в туннель, а сервер молчит в ответ: это форвардинг или NAT на сервере (проверь `sysctl net.ipv4.ip_forward` - должно быть 1, и что в `iptables -t nat -L POSTROUTING -n` есть строка MASQUERADE; наш установщик их ставит сам, но если ставил не им или правил руками - гляди сюда). Растут оба - трафик ходит в обе стороны, тогда почти наверняка DNS. Received почти ноль - трафик вообще не заходит в туннель, смотри AllowedIPs на клиенте.

2. С клиента, не отключая VPN:

```
ping 10.9.9.1
ping 1.1.1.1
```

`10.9.9.1` - это адрес сервера в туннеле (Address в `[Interface]` серверного конфига, у тебя может отличаться). Пингуется `1.1.1.1`, а сайты не открываются - это DNS: пропиши в конфиге клиента `DNS = 1.1.1.1`. Не пингуется даже `10.9.9.1` - проверь на клиенте `AllowedIPs = 0.0.0.0/0`.

3. Если пинги идут, а трафик всё равно рваный - на мобиле это почти всегда MTU. Хендшейк мелкий, проскакивает, а крупные пакеты при большом MTU тихо теряются - ровно твоё "подключился, а трафика нет". Поставь в конфиге клиента `MTU = 1280`.

Начни с первого шага, `awg show` сразу покажет - сервер, DNS или клиент. Черкни, растёт ли received и пингуется ли `1.1.1.1`.

**Reply by Craiver** [reply]
На сервере растёт received, а transfer почти ноль.
 sysctl net.ipv4.ip_forward - стоит 1;
 MASQUERADE - все ноли;
 10.9.9.1 и 1.1.1.1 - не пингуются.
В клиенте не нашел функционала заменить AllowedIPs на = 0.0.0.0/0. 
upd: через бэкап изменил AllowedIPs на = 0.0.0.0/0. Замена не помогла.
 
 Может важно: 
 На телефоне и на ПК стоит из инструкции Amnezia VPN настроенная через vpn:// URI
 Режим маршрутизации по умолчанию 2. (и все другие настройки тоже по инструкции прописывал)

**Reply by bivlked** [reply]
Отлично, что всё прогнал - по этим цифрам уже видно, где рвётся. Received на сервере растёт, значит пакеты долетают и расшифровываются нормально. А дальше тупик: sent почти ноль, через NAT ноль пакетов, даже сам сервер по 10.9.9.1 не отвечает. Сервер роняет твои пакеты сразу после расшифровки, ещё до маршрутизации - вот почему форвардинг и NAT ни при чём (ты верно проверил, ip_forward=1 и правило на месте), до них дело не доходит.

Роняет по одной причине: WireGuard смотрит, с какого адреса в туннеле пришёл пакет, и сверяет с тем, что записано для этого клиента на сервере (allowed-ips). Не совпало - пакет умирает прямо там. Под твои симптомы ложится точно.

Проверить - на сервере:

```
awg show awg0
```

Найди свой peer и сравни строку allowed ips с полем Address из клиентского конфига: должен быть один /32, и одинаковый (обычно 10.9.9.2/32). Разошлись - вот причина, клиента надо перевыпустить, чтобы адреса сошлись.

И заодно: Amnezia у тебя на телефоне и на ПК - если это один и тот же vpn:// на обоих, разведи на два клиента (`bash /root/awg/manage_amneziawg.sh add`, каждому свой). Один ключ на двух устройствах сам по себе мутит воду.

Скинь awg show awg0 и скажи - один конфиг на телефоне и ПК или разные. Тогда ткну точно.

**Reply by Craiver** [reply]
allowed ips с полем Address совпадают
Сервер:
endpoint: 195.222.141.128:4615
  allowed ips: 10.9.9.2/32
  latest handshake: 9 hours, 7 minutes, 9 seconds ago
  transfer: 22.37 KiB received, 248.13 KiB sent
  Клиент:
  Address = 10.9.9.2/32
DNS = 1.1.1.1, 1.0.0.1
MTU = 1280

Да. Подключал один и тот же vpn:// на оба устройства, но само собой одновременно не цеплял, чтобы не конфликтовали.
Сейчас на всякий добавлю второго клиента.

Не знаю, можно ли так. Попробовал так проверить доступность порта
 Test-NetConnection -ComputerName 193.124.91.61 -Port 39743
ПРЕДУПРЕЖДЕНИЕ: TCP connect to (193.124.91.61 : 39743) failed


ComputerName           : 193.124.91.61
RemoteAddress          : 193.124.91.61
RemotePort             : 39743
InterfaceAlias         : Беспроводная сеть
SourceAddress          : 192.168.0.119
PingSucceeded          : True
PingReplyDetails (RTT) : 86 ms
TcpTestSucceeded       : False

**Reply by bivlked** [reply]
Спасибо за подробный вывод, теперь всё встало на места. Главное - вот эта строка:

`latest handshake: 9 hours, 7 minutes ago`

Рабочий туннель переподключается каждые пару минут, а у тебя последнее рукопожатие девятичасовой давности. Значит прямо сейчас туннель не поднят - оттого ничего и не пингуется. Но `248 KiB sent` говорит, что один раз он поднялся и трафик реально пошёл. То есть конфиг нормальный (allowed-ips с Address у тебя совпали), дело не в нём: он цепляется на секунду и отваливается.

А отваливается вот почему. Оператор МТС, порт VPN - 39743 (видно в UFW). Мы ровно эту связку гоняли в полях: **39743/udp на МТС глушится, а 443/udp работает** - на 443 трафик похож на обычный QUIC/HTTP3 и проходит. Твои цифры сходятся: сервер отдаёт (те самые 248 KiB), но пакеты летят на мобильный NAT, который уже сменил адрес, до тебя не доходят, и рукопожатие не может обновиться - вот и виснет на девять часов.

Чинится сменой порта на 443. Команды на сервере:

```
sed -i 's/^ListenPort = .*/ListenPort = 443/' /etc/amnezia/amneziawg/awg0.conf
sed -i 's/^export AWG_PORT=.*/export AWG_PORT=443/' /root/awg/awgsetup_cfg.init
ufw allow 443/udp comment "AmneziaWG VPN"
bash /root/awg/manage_amneziawg.sh restart && bash /root/awg/manage_amneziawg.sh regen
```

`regen` перевыпустит клиентские конфиги уже с портом 443 - забери на телефон и ПК свежий QR или `.conf`, старые с 39743 не годятся (в новом конфиге строка `Endpoint` должна кончаться на `:443`). Команды связаны через `&&` нарочно: если сервер вдруг не поднимется, конфиги не перепишутся. Старое правило UFW на 39743 потом можно убрать.

Два момента из твоего вывода:

- `Test-NetConnection ... -Port 39743` показал `False`, но это ничего не значит: команда проверяет TCP, а VPN-порт у нас UDP, по нему такой тест всегда падает. Так доступность не проверить.
- В начале сервер у тебя был `150.251.145.6`, а Test-NetConnection ты делал на `193.124.91.61`. Это один сервер (сменил IP) или разные? Проверь, что Endpoint в конфиге клиента смотрит на ту же машину, где меняешь порт.

Поменяй порт, забери свежий конфиг, напиши - поднялось ли. Заработает - в `awg show` рукопожатие станет свежим, пара минут, а не девять часов.

**Reply by Craiver** [reply]
Да. Я перепутал и ввел тебя в заблуждение. На сервере received стоит около 2 kib, А sent растет. 
Последнее рукопожатие девятичасовой давности, как я понимаю, из-за того, что последний раз я подключался 9 часов назад перед выгрузкой статуса.
Заменил порт на 443 - ничего не изменилось. Проверил в UFW - 443 порт добавился. Забрал новый URI. Проверил что в клиенте порт заменился.
Подключил выделенный IP, поэтому другой адрес.

**Reply by bivlked** [reply]
Понял, спасибо - порт вычёркиваем, и за путаницу со счётчиками не переживай.

Смысл такой: VPN подключается, хендшейк есть, а сайты не открываются. Я специально поднял наш дефолтный конфиг (с той же маскировкой, что у тебя) на своём тестовом сервере - трафик через туннель ходит нормально. Значит сам сервер почти наверняка в порядке, а рвётся где-то между твоим клиентом и туннелем. Это уже добить недолго.

Начни с самого простого, оно сразу отсекает половину:

**На телефоне интернет через VPN работает?** Если на телефоне сайты открываются, а на ПК нет - сервер точно ни при чём, дело в клиенте на ПК (это полный AmneziaVPN, он иногда капризничает). Тогда есть что попробовать, но сперва подтвердим телефоном.

Если и на телефоне пусто - снимем точную картину. Подключись с клиента, а на сервере глянь:

```
awg show awg0
```

Рукопожатие теперь должно быть свежее - пара секунд, не часы. Потом в другом окне запусти на сервере

```
tcpdump -ni awg0 icmp
```

и с клиента пингани `1.1.1.1`. Побежали в tcpdump пакеты с твоего туннельного адреса `10.9.9.2` - значит трафик до сервера доходит, копаем дальше уже на сервере. Пусто - клиент не заворачивает трафик в туннель, тогда причина в нём. (Нет `tcpdump` - поставь `apt install -y tcpdump`.)

Начни с телефона, скорее всего там сразу и прояснится. Черкни, что вышло.

**Reply by Craiver** [reply]
AmneziaVPN в телефоне точно так же не работает. 
Хэндшейк свежий. С клиента пинганул 1.1.1.1. Не отвечает.  tcpdump - тишина. Ноли.
С клиента попасть могу только на роутер 192.168.0.1 ( AllowedIPs снова дефолтные)

**Reply by bivlked** [reply]
Спасибо, этот тест хорошо сужает круг. tcpdump на awg0 молчит при пинге, а рукопожатие свежее - значит пакеты от клиента до туннеля на сервере не доходят. Серверную сторону мы в прошлых кругах уже сверяли (allowed-ips пира совпадал с Address клиента), так что главный подозреваемый теперь - клиент: он не отправляет трафик в туннель.

Смотри на строку `AllowedIPs` в клиентском конфиге. Наш установщик кладёт туда список, который покрывает и 1.1.1.1 (`1.0.0.0/8, 2.0.0.0/7, ...`) - будь он на месте, пинг ушёл бы в туннель и засветился бы в tcpdump. А раз у тебя «дефолтные» и в туннель ничего не идёт, похоже приложение AmneziaVPN переписало AllowedIPs своим тумблером разделения трафика, и в туннель попадает только локалка.

Сначала попробуй по-чистому: на сервере `manage regen <имя_клиента>`, в приложении удали старое подключение целиком и импортируй свежий конфиг, AllowedIPs руками не трогай. Если и после этого тишина - пришли строки `AllowedIPs =` и `Address =` из клиентского конфига плюс `awg show awg0` с сервера, и напиши, чем подключаешься (приложение AmneziaVPN или wg/CLI). По ним сразу видно, где рвётся.

**Reply by Craiver** [reply]
Клиент AmneziaVPN 4.8.19.0 (из инструкции)
Address = [10.9.9.2/32]
DNS = [1.1.1.1],[1.0.0.1]
MTU = 1280
...
Endpoint = [193.124.91.61:443]
AllowedIPs = [1.0.0.0/8,2.0.0.0/7,4.0.0.0/6,8.0.0.0/7,11.0.0.0/8,12.0.0.0/6,16.0.0.0/4,32.0.0.0/3,64.0.0.0/2,128.0.0.0/3,160.0.0.0/5,168.0.0.0/6,172.0.0.0/12,172.32.0.0/11,172.64.0.0/10,172.128.0.0/9,173.0.0.0/8,174.0.0.0/7,176.0.0.0/4,192.0.0.0/9,192.128.0.0/11,192.160.0.0/13,192.169.0.0/16,192.170.0.0/15,192.172.0.0/14,192.176.0.0/12,192.192.0.0/10,193.0.0.0/8,194.0.0.0/7,196.0.0.0/6,200.0.0.0/5,208.0.0.0/4,8.8.8.8/32,1.1.1.1/32]

Сервер
endpoint: [91.79.197.97:16403]
  allowed ips: [10.9.9.2/32]
  latest handshake: 54 seconds ago
  transfer: 6.20 KiB received, 78.05 KiB sent

**Reply by bivlked** [reply]
Спасибо, теперь картина полная. Конфиг сходится с обеих сторон: AllowedIPs у клиента покрывает и 1.1.1.1 (там и 1.0.0.0/8, и явный 1.1.1.1/32), на сервере allowed ips 10.9.9.2/32 совпадает с Address клиента, рукопожатие свежее. Серверную сторону это делает маловероятной причиной, но чтобы не гадать - следующий тест разведёт клиента и сервер начисто.

Теперь что осталось. tcpdump на awg0 при пинге молчит, и раньше даже AllowedIPs = 0.0.0.0/0 ничего не изменил. Значит, дело уже не в AllowedIPs: полный клиент AmneziaVPN просто не заворачивает трафик в туннель. И глухо одинаково на телефоне и на ПК - а это один и тот же полный AmneziaVPN.

Есть у него известная засада: полный клиент иногда спотыкается о маскировку AmneziaWG 2.0 (её скрывающие пакеты, параметр I1) уже после того, как рукопожатие прошло, и трафик тогда не идёт. Недавно у другого пользователя было ровно это на десктопе, снялось переходом на лёгкий клиент. Поэтому им и проверим - одно действие, и сразу станет ясно:

- На телефоне поставь из маркета AmneziaWG - это лёгкий клиент, не полный AmneziaVPN.
- Скорми ему обычный конфиг-QR: файл /root/awg/<имя>.png или сам <имя>.conf, тот самый, что ты уже качал через scp. Не vpn://-ссылку.
- Подключись и попробуй открыть любой сайт.

Пойдёт на лёгком - значит дело в полном приложении. Дальше либо остаёшься на лёгком клиенте, либо я перевыпущу тебе конфиг в варианте, который полный AmneziaVPN переваривает без этой засады. Черкни, что вышло.

**Reply by Craiver** [reply]
[amneziawg-log.txt](https://github.com/user-attachments/files/29737377/amneziawg-log.txt)
На легком то же самое. Лог из AmneziaWG прикрепляю.

**Reply by bivlked** [reply]
Спасибо за лог - по нему уже видно, где рвётся.

Лёгкий клиент AmneziaWG рукопожатие проходит: в логе есть "Received handshake response" и статус CONNECTED. Значит сервер доступен, обфускация и версии сходятся, тут порядок. А через 15 секунд начинается "stopped hearing back" и бесконечные попытки заново, на которые сервер уже молчит. Первый обмен прошёл, а дальше ответы сервера до телефона не доходят. На сервере видно то же самое: отдал 78 КБ, а принял всего 6.

Значит дело не в приложении (лёгкий и полный ведут себя одинаково) и не в обфускации (иначе бы и рукопожатие не встало) - тот же конфиг у меня на тестовом сервере работает без нареканий. А у тебя сломалось примерно тогда, когда ты подключил выделенный IP, так что смотрю на него в первую очередь. Похоже, сервер принимает пакеты на 193.124.91.61, но отвечает не с него, а со своего основного адреса. Ответ с чужого IP телефон не ждёт и отбрасывает - оттого первый обмен ещё проскакивает, а дальше глухо.

Проверим, это быстро:

1. Подключись с телефона через Wi-Fi или любую не-сотовую сеть. Заработало - значит режет сотовый оператор, а сервер чист.

2. Проверка того самого IP. На сервере, пока телефон пытается подключиться, запусти:
```
ip -4 addr
tcpdump -ni any udp port 443
```
В tcpdump смотри пакеты, уходящие в сторону телефона: source у них должен быть 193.124.91.61. Отвечает с другого адреса - вот и причина, дальше подскажу, как привязать ответы к нужному IP.

Начни с Wi-Fi, он сразу покажет направление. Черкни, что вышло.

**Reply by Craiver** [reply]
> А у тебя сломалось примерно тогда, когда ты подключил выделенный IP

Нет. Изначально не работало. Как выяснил, без выделенного IP порты были закрыты хостом. 
Смена точки доступа на wifi не влияет.

1: lo: <LOOPBACK,UP,LOWER_UP> mtu 65536 qdisc noqueue state UNKNOWN group default qlen 1000
    inet 127.0.0.1/8 scope host lo
       valid_lft forever preferred_lft forever
2: eth0: <BROADCAST,MULTICAST,UP,LOWER_UP> mtu 1500 qdisc fq state UP group default qlen 1000
    altname enp0s18
    inet 193.124.91.61/24 brd 193.124.91.255 scope global eth0
       valid_lft forever preferred_lft forever
4: awg0: <POINTOPOINT,NOARP,UP,LOWER_UP> mtu 1280 qdisc noqueue state UNKNOWN group default qlen 1000
    inet 10.9.9.1/24 scope global awg0
       valid_lft forever preferred_lft forever
tcpdump: data link type LINUX_SLL2
tcpdump: verbose output suppressed, use -v[v]... for full protocol decode
listening on any, link-type LINUX_SLL2 (Linux cooked v2), snapshot length 262144 bytes
14:25:24.065332 eth0  In  IP 77.43.213.210.5126 > 193.124.91.61.443: UDP, length 126
14:25:24.069239 eth0  In  IP 77.43.213.210.5126 > 193.124.91.61.443: UDP, length 126
14:25:24.077326 eth0  Out IP 193.124.91.61.443 > 77.43.213.210.5126: UDP, length 254
14:25:24.083805 eth0  Out IP 193.124.91.61.443 > 77.43.213.210.5126: UDP, length 254
14:25:24.181120 eth0  In  IP 77.43.213.210.5126 > 193.124.91.61.443: UDP, length 110
14:25:24.197270 eth0  Out IP 193.124.91.61.443 > 77.43.213.210.5126: UDP, length 110
14:25:24.284267 eth0  In  IP 77.43.213.210.5126 > 193.124.91.61.443: UDP, length 94
14:25:24.286752 eth0  In  IP 77.43.213.210.5126 > 193.124.91.61.443: UDP, length 206
14:25:24.303783 eth0  Out IP 193.124.91.61.443 > 77.43.213.210.5126: UDP, length 286
14:25:24.303886 eth0  Out IP 193.124.91.61.443 > 77.43.213.210.5126: UDP, length 94
14:25:24.398690 eth0  In  IP 77.43.213.210.5126 > 193.124.91.61.443: UDP, length 94
14:25:24.398956 eth0  In  IP 77.43.213.210.5126 > 193.124.91.61.443: UDP, length 94
14:25:24.415013 eth0  Out IP 193.124.91.61.443 > 77.43.213.210.5126: UDP, length 94
14:25:25.961513 eth0  In  IP 77.43.213.210.5126 > 193.124.91.61.443: UDP, length 126
14:25:25.966316 eth0  In  IP 77.43.213.210.5126 > 193.124.91.61.443: UDP, length 126
14:25:25.966399 eth0  Out IP 193.124.91.61.443 > 77.43.213.210.5126: UDP, length 142
14:25:25.983282 eth0  Out IP 193.124.91.61.443 > 77.43.213.210.5126: UDP, length 206

**Reply by bivlked** [reply]
@Craiver спасибо за tcpdump, и что поправил меня насчёт IP - прошлую догадку про второй адрес снимаю. Ты прав: адрес один, и он был нужен с самого начала, без него хостер держал порты закрытыми.

По дампу видно главное. Сервер твои пакеты принимает и отвечает - с правильного адреса 193.124.91.61:443, тем же портом, что клиент и ждёт. Рукопожатие AmneziaWG проходит (оттого и CONNECTED), ответы уходят обратно, но до клиента не доезжают, и через 15 секунд всё по новой. Одинаково на Wi-Fi и на сотовом, на телефоне и на ПК.

А это и есть подсказка. Раз сервер пакеты отдаёт, а теряются они при любой твоей сети и на любом устройстве, дело не в клиенте, не в конфиге и не в скрипте - их мы уже сверили вдоль и поперёк. Остаётся участок за сервером, сеть хостера. А хостер у тебя строгий, раз порты по умолчанию закрыты: похоже, режет или лимитирует UDP на этом выделенном IP (анти-абьюз, DDoS-профиль или кривой проброс адреса). Сервер, кстати, в Эстонии, так что РКН ни при чём.

Что попробовать, от простого к решающему:

1. Спроси поддержку в лоб: полностью ли открыт UDP на 193.124.91.61 в обе стороны, нет ли фильтра, лимита или DDoS-профиля.
2. Смени порт на высокий случайный UDP, не 443 - на 443 у части хостеров своя обработка. Дело пяти минут.
3. Подними тот же конфиг нашим скриптом на другом нормальном хостере (Hetzner и подобные). Заработает там - значит виновата сеть текущего, и это уже точный ответ.

По всем признакам конфиг у тебя рабочий, упёрлось в сеть хоста, а не в тебя.

**Reply by Craiver** [reply]
Тп хостинга говорит, что ограничений нет.
Все снёс и накатил сервер self hosted vpn из функционала амнезии впн. Подлючилось. Работает.
Непонятно...

**Reply by bivlked** [reply]
Ну и славно, что заработало - это главное.

И версию про сеть хостера я приторможу. Раз приложение Amnezia подняло на том же сервере и IP рабочий сервер, моя догадка слабеет: будь там глухой фильтр UDP, у приложения бы тоже не встало. Хотя совсем со счетов хостера не снимаю - приложение могло уйти на другой порт или вообще на другой протокол, а это уже другой трафик.

Честно говоря, точную причину без повтора я не назову. Скорее всего дело в разнице между тем, что генерит мой скрипт, и тем, что развернуло приложение: оно ставит сервер в своём контейнере с другими дефолтами - другая обфускация, другой MTU, а если протокол ты вручную не выбирал, там мог оказаться и не AmneziaWG. Твой симптом (рукопожатие проходит, CONNECTED, а через 15 секунд тишина) укладывается в версию, что мелкие пакеты пролезают, а те, что покрупнее - уже нет. Но по дампу видно только рукопожатие, крупных пакетов данных там не поймано, так что это версия, а не приговор.

Гоняться за этим ради тебя уже незачем - у тебя всё работает. А вот если захочешь помочь мне добить это для других (без всякого давления): глянь, какой протокол и порт в итоге подняло приложение и с каким MTU. Если это тоже AmneziaWG - сравню с тем, что ставит скрипт, и пойму, что стоит поджать. Спасибо, что довёл до конца и поправлял по дороге.

**Reply by Craiver** [reply]
Рано радовался. Работает только через WiFi мтс. Через сим обоих операторов нет.
При развертывании выбирал амнезия wg.
Остальное в авто режиме поставилось: mtu 1280,  порт 49489. 
Скриншоты прикрепил 
<img width="1008" height="2244" alt="Screenshot_20260708-191651" src="https://github.com/user-attachments/assets/508dfbe9-96e0-4485-892e-e53ba2aa8ee5" />
<img width="1008" height="2244" alt="Screenshot_20260708-191621" src="https://github.com/user-attachments/assets/fade9397-060e-4141-8d0e-4881096a2201" />

**Reply by bivlked** [reply]
По WiFi работает, а на симке нет, причём на всех трёх операторах - это сужает круг до мобильного канала. Сервер и конфиг живые, иначе и по WiFi бы не поднялось. Рвётся именно сотовая передача.

Важный момент: ты ведь в итоге поднял сервер через само приложение Amnezia (порт 49489, MTU 1280), так что команды нашего установщика к нему уже не подходят - настройки крутить в приложении.

Два типичных виновника ровно для "WiFi работает, сотовая нет":

1. MTU. Самая частая причина именно такой разницы. У сотовой сети путь до сервера короче, чем у WiFi, и крупные пакеты в туннеле начинают теряться, хотя по WiFi всё проходит. 1280 обычно берут за нижнюю планку, но у некоторых операторов помогает ещё ниже - попробуй в конфиге клиента MTU = 1240, потом 1200.

2. Оператор режет обфусцированный UDP на мобильной сети. Порт 443 ты уже гонял на прошлом сервере, не помогло, так что если и MTU не сдвинет - скорее всего дело в этом.

Чтобы понять, что именно: на симке VPN вообще не подключается (нет рукопожатия) или подключается, а интернета нет? Первое - оператор рубит на входе, второе - почти наверняка MTU.

Если ни MTU, ни порт не помогут, а WiFi продолжит работать, самый надёжный обход мобильных фильтров - каскад (вход в России, выход за границей). Мы его недавно описали в доке: https://bivlked.github.io/amneziawg-installer/ru/cascade/

**Reply by Craiver** [reply]
За эти дни уже все перепробовал. 
1. Менял MTU
2. Менял порт на 443
3. С амнезии переходил на Xray. Вообще не работал.
Итог подключается, но трафика нет. Судя по клиенту, мелкие пакеты проскакивают, но не более.
Понятно, что тспу оператора блокирует. Осталось непонятно, почему Ваш скрипт через wifi не работал.

**Reply by glfenix** [reply]
> За эти дни уже все перепробовал.

Думаю самый короткий путь решения проблемы. Сходить к [chat](https://chatgpt.com/)  и с ним побеседовать. Он легко сможет довести до результата. 
Есть масса способов проверить работу UDP, диагностировать сетевые проблемы с помощью тогоже tcpdump. Я бы, просто сменил VPS для начала, ну или сделать полную переустановку. Всегда решать проблемы на чистой свежей инсталляции проще.

**Reply by bivlked** [reply]
Отвечу честно: точную причину я так и не назвал. Перебрали почти всё - серверный ACL, порт, клиентский AllowedIPs, баг GUI-клиента, выделенный IP, фильтр хостера, - и каждая версия разбивалась об очередной твой тест. Осталась одна неотработанная разница: мой скрипт ставит свой набор обфускации, а приложение развернуло AmneziaWG со своими дефолтами в своём контейнере. Но и это версия, а не приговор. У меня в полевом тесте на МТС лёгкий клиент amneziawg - ровно тот, что стоял у тебя, - с моими параметрами работает нормально. Значит дело не в параметрах как таковых, а в том, как они легли на твоё окружение. Без повтора я это не докажу, а гонять тебя ради этого не буду: у тебя работает.

VPS менять не надо, это пустая трата. На той же машине и том же IP приложение поднялось и по WiFi работает - значит и сервер живой, и сеть хостера пропускает.

Xray тоже вычеркни, и дело тут не в твоём операторе: VLESS+Reality на российских сетях выбили массово, он лёг бы у тебя в любом случае. Так что его провал ничего нового про ТСПУ не сказал.

Непробованного осталось два хода, начни с дешёвого. Порт: сейчас у тебя 49489, высокий нестандартный UDP. Я гонял полевой тест на МТС - дефолтный 39743 там глухо, а 443/udp проходит, потому что выглядит как QUIC и резать его целиком оператору невыгодно. Твой 49489 такой же высокий и нестандартный, так что шанс, что он в той же корзине, приличный. На моём сервере 443 ты пробовал, а на нынешнем, от приложения, - не знаю. Если приложение даёт задать порт руками и ты этого ещё не делал, попробуй: пять минут, а вдруг.

Второй ход надёжнее, но дороже - каскад: вход в России, выход за границей. Оператору там нечего резать, для него это обычный внутренний трафик. Обфускация прячет, что ты шлёшь, а каскад меняет, куда - потому он и работает там, где перебор параметров уже бессмыслен. Как поднять: https://bivlked.github.io/amneziawg-installer/ru/cascade/

**Comment by esmik92-ship-it** [comment]
Добрый день. У меня настроен именно каскад.
Захожу в Москве, выхожу в Амстердаме. Сервера на rdp-onedash.
Подскажите, куда копать.

**Comment by bivlked** [comment]
Добрый день. Уточните, что именно не работает: у каскада обычно ломается одно из трёх мест, и лечится каждое по-своему. Тред, в который вы написали, про одиночный сервер и отсутствие рукопожатия, так что ваш случай, скорее всего, другой.

Чтобы не гонять вас лишний раз, вот все три с первой командой для каждого. Всё выполняется на входном сервере (Москва) под root. Имена интерфейсов и номер таблицы - как в моём гайде по каскаду; если собирали по своей схеме, подставьте свои.

1. Клиент не подключается вовсе, рукопожатия нет. Каскад тут ни при чём, это обычная проблема входного сервера:

```
awg show awg0
```

Смотрите `latest handshake` у своего пира. Пусто - пакеты клиента до входа не доходят, и дело в порте, UFW или операторе.

2. Клиент подключился, а интернета нет совсем. Проверяйте дальнее плечо и маршрут:

```
awg show awg1
ip route show table 100
```

`awg1` это туннель AmneziaWG до Амстердама, но живёт он на входном сервере. У первой команды должно быть свежее `latest handshake`, у второй - строка `default dev awg1 scope link`.

3. Интернет есть, но заграничные сайты видят российский адрес. Команда та же, `ip route show table 100`, а случай самый обидный: снаружи всё выглядит рабочим.

Маршрут в эту таблицу кладёт только `awg-routing.sh`: в `/etc/amnezia/amneziawg/awg1.conf` стоит `Table = off`, и `awg-quick` сам ничего не прокладывает. Стоит `awg1` разок опуститься, ядро сносит маршрут вместе с интерфейсом, а правило `ip rule` остаётся на месте. Обычно всё поднимается само, юнит `awg-routing` завязан на оба туннеля через `Requires`, но если интерфейс дёргали руками или после перезагрузки `awg1` не встал, юнит не отработает и таблица останется пустой.

Дальше я это отдельно проверял на стенде: **правило по метке при пустой таблице не ругается, а молча проваливается в основную таблицу**. Весь клиентский трафик уходит через WAN входного сервера, то есть с российского адреса. Туннели при этом живы, `ipset` на месте, в логах ни строки. Со стороны это выглядит как «VPN работает», просто заграничные сервисы видят Россию.

Лечится одной командой:

```
systemctl restart awg-routing
```

Проверить с клиента: `curl https://ifconfig.me` должен показать адрес амстердамского сервера. Покажет московский - маршрута нет.

Если разбираться некогда, выполните на входном вот это и пришлите вывод, по нему видно почти всё сразу (строку `endpoint` можно замазать, там ваш домашний адрес):

```
awg show; ip rule show | grep fwmark; ip route show table 100; ipset list ru | grep Number
```

Остальные случаи разобраны в диагностике гайда: https://github.com/bivlked/amneziawg-installer/blob/main/CASCADE.md#trouble

**Reply by esmik92-ship-it** [reply]
Добрый день. снова беда. 

Ситуация следующая, подключение есть, а интернета нет совсем. 

root@VM-400754:~# **awg show awg0**
interface: awg0
  public key: NG89AG+A6sle/xseIx0oBaAIJFDDh3NEg/mEtXW8sxI=
  private key: (hidden)
  listening port: 48255
  jc: 3
  jmin: 40
  jmax: 100
  s1: 41
  s2: 91
  s3: 24
  s4: 7
  h1: 84026777-1112181861
  h2: 1287139597-1541346186
  h3: 1609927849-1800027496
  h4: 1958577129-2081889164
  i1: <r 64>
  random trailers: off
  disable cookies: off

peer: /pWHR9tv3hkbiUpQkiJ2IvPNIn72YzaqJmt8PXhVIlI=
  endpoint:  ***.***.**.**:61272
  allowed ips: 10.9.0.5/32
  latest handshake: 3 seconds ago
  transfer: 309.43 MiB received, 5.37 GiB sent

peer: yfpSuSq6S4//iHxb5XB9yjMLBG9/RscTr5zjG9+P6T8=
  endpoint:  ***.***.**.**:2061
  allowed ips: 10.9.0.4/32
  latest handshake: 9 minutes, 17 seconds ago
  transfer: 292.21 MiB received, 6.97 GiB sent

peer: fMzBoLIGvjOLOt0k7laS/sAbG2+XuCdNfGKTPhFqEVc=
  preshared key: (hidden)
  endpoint:  ***.***.**.**:64408
  allowed ips: 10.9.0.15/32
  latest handshake: 14 minutes, 40 seconds ago
  transfer: 30.29 MiB received, 202.62 MiB sent

peer: USGBFNbpLUTLgiKcir6P+JUxdQUE+Zr3KDJJc+HrgUI=
  endpoint: ***.***.**.**:2051
  allowed ips: 10.9.0.3/32
  latest handshake: 28 minutes, 42 seconds ago
  transfer: 9.90 MiB received, 23.39 MiB sent

peer: sL+TkWKjRria9jQNYXVctNuZwkDEiAWlP87LOyL/cFk=
  preshared key: (hidden)
  endpoint:  ***.***.**.**:1375
  allowed ips: 10.9.0.11/32
  latest handshake: 31 minutes, 59 seconds ago
  transfer: 66.54 MiB received, 1.15 GiB sent

peer: AddkGv1PaRUjibofMyFnC36LicsKzP7tN2Sw/zwQIhk=
  endpoint:  ***.***.**.**:18439
  allowed ips: 10.9.0.7/32
  latest handshake: 51 minutes, 19 seconds ago
  transfer: 15.51 MiB received, 148.29 MiB sent

peer: LEc7qjmooRpjAmHuONCQT1fOYM5vFTfXrbg8J9Zneho=
  endpoint:  ***.***.**.**:60876
  allowed ips: 10.9.0.10/32
  latest handshake: 52 minutes, 42 seconds ago
  transfer: 41.74 MiB received, 1.28 GiB sent

peer: 8blMQOY0CM9+6IOa+8fTvR61DEPvjvreaVcDM8gGPHc=
  endpoint:  ***.***.**.**:1135
  allowed ips: 10.9.0.8/32
  latest handshake: 1 hour, 58 minutes, 5 seconds ago
  transfer: 63.57 MiB received, 663.65 MiB sent

peer: dipPENq8fnxcbHQTRjozaJ9ArLzmIVvk9pME0orpEwI=
  endpoint:  ***.***.**.**:8242
  allowed ips: 10.9.0.6/32
  latest handshake: 4 hours, 49 minutes, 12 seconds ago
  transfer: 483.36 MiB received, 15.40 GiB sent

peer: +EvaKBQMWz2e8qUJCGD/pQTtVAOFvI/NhYYetPjFlAw=
  allowed ips: 10.9.0.2/32

peer: X87RGbZR6ZFUFqb+94FyjhnoO6Il5oltT7U0sdh4eig=
  allowed ips: 10.9.0.9/32

peer: MPjVj+GKW85Qct/M0ADeXLyE8JcdyLAl4Dr7aMMUBDA=
  allowed ips: 10.9.0.12/32

peer: e2eUEwsJ7xfh5mPCNmqU0kT8zD7Hh6AWNVRM5NDQQwA=
  allowed ips: 10.9.0.13/32

peer: jPxjH4jnCJXSugDbwXkVMQxMqbUaB3CdEvc6Rz1aGWs=
  allowed ips: 10.9.0.14/32
root@VM-400754:~# **awg show awg1**
interface: awg1
  public key: U8IsSiQ5vOvjHbT1iBf/Oxr03WJdVl6+wpTiIf5Oamc=
  private key: (hidden)
  listening port: 55739
  jc: 3
  jmin: 39
  jmax: 72
  s1: 74
  s2: 90
  s3: _54_
  s4: 26
  h1: 197424264-243162930
  h2: 988764915-1020228683
  h3: 1065504861-1072009556
  h4: 1125125249-2031567689
  i1: <r 151>
  random trailers: off
  disable cookies: off

peer: LmfwFTwWHpFdKk36MakAbmF4FXUd3l7pZ31e/f9FXgs=
  endpoint: ++.+++.+++.++:***
  allowed ips: 0.0.0.0/0, ::/0
  latest handshake: 14 hours, 45 seconds ago
  transfer: 30.16 GiB received, 1.37 GiB sent
  persistent keepalive: 33
root@VM-400754:~# 
root@VM-400754:~# **ip route show table 100**
default dev awg1 scope link 


latest handshake был 14 часов назад

Попытка войти на awg1 не увенчалась успехом.
Хостер отвечает: 
__Перезапуск выполнен, VPS активен и готов к подключению. Однако удалённая проверка SSH всё ещё не подтверждает доступность.
Нужна ручная проверка._

root@VM-400754:~# **awg show; ip rule show | grep fwmark; ip route show table 100; ipset list ru | grep Number**
interface: awg1
  public key: U8IsSiQ5vOvjHbT1iBf/Oxr03WJdVl6+wpTiIf5Oamc=
  private key: (hidden)
  listening port: 55739
  jc: 3
  jmin: 39
  jmax: 72
  s1: 74
  s2: 90
  s3: 54
  s4: 26
  h1: 197424264-243162930
  h2: 988764915-1020228683
  h3: 1065504861-1072009556
  h4: 1125125249-2031567689
  i1: <r 151>
  random trailers: off
  disable cookies: off

peer: LmfwFTwWHpFdKk36MakAbmF4FXUd3l7pZ31e/f9FXgs=
  endpoint: 89.37.192.65:48255
  allowed ips: 0.0.0.0/0, ::/0
  latest handshake: 14 hours, 7 minutes, 10 seconds ago
  transfer: 30.16 GiB received, 1.37 GiB sent
  persistent keepalive: 33

interface: awg0
  public key: NG89AG+A6sle/xseIx0oBaAIJFDDh3NEg/mEtXW8sxI=
  private key: (hidden)
  listening port: 48255
  jc: 3
  jmin: 40
  jmax: 100
  s1: 41
  s2: 91
  s3: 24
  s4: 7
  h1: 84026777-1112181861
  h2: 1287139597-1541346186
  h3: 1609927849-1800027496
  h4: 1958577129-2081889164
  i1: <r 64>
  random trailers: off
  disable cookies: off

peer: /pWHR9tv3hkbiUpQkiJ2IvPNIn72YzaqJmt8PXhVIlI=
  endpoint: **.***.**.**:61272
  allowed ips: 10.9.0.5/32
  latest handshake: 2 minutes, 48 seconds ago
  transfer: 309.53 MiB received, 5.37 GiB sent

peer: yfpSuSq6S4//iHxb5XB9yjMLBG9/RscTr5zjG9+P6T8=
  endpoint: **.***.**.**:2061
  allowed ips: 10.9.0.4/32
  latest handshake: 20 minutes, 27 seconds ago
  transfer: 292.21 MiB received, 6.97 GiB sent

peer: fMzBoLIGvjOLOt0k7laS/sAbG2+XuCdNfGKTPhFqEVc=
  preshared key: (hidden)
  endpoint: **.***.**.**:64408
  allowed ips: 10.9.0.15/32
  latest handshake: 25 minutes, 50 seconds ago
  transfer: 30.29 MiB received, 202.62 MiB sent

peer: USGBFNbpLUTLgiKcir6P+JUxdQUE+Zr3KDJJc+HrgUI=
  endpoint: **.***.**.**:2051
  allowed ips: 10.9.0.3/32
  latest handshake: 39 minutes, 52 seconds ago
  transfer: 9.90 MiB received, 23.39 MiB sent

peer: sL+TkWKjRria9jQNYXVctNuZwkDEiAWlP87LOyL/cFk=
  preshared key: (hidden)
  endpoint: **.***.**.**:1375
  allowed ips: 10.9.0.11/32
  latest handshake: 43 minutes, 9 seconds ago
  transfer: 66.54 MiB received, 1.15 GiB sent

peer: AddkGv1PaRUjibofMyFnC36LicsKzP7tN2Sw/zwQIhk=
  endpoint: **.***.**.**:18439
  allowed ips: 10.9.0.7/32
  latest handshake: 1 hour, 2 minutes, 29 seconds ago
  transfer: 15.51 MiB received, 148.29 MiB sent

peer: LEc7qjmooRpjAmHuONCQT1fOYM5vFTfXrbg8J9Zneho=
  endpoint: **.***.**.**:60876
  allowed ips: 10.9.0.10/32
  latest handshake: 1 hour, 3 minutes, 52 seconds ago
  transfer: 41.74 MiB received, 1.28 GiB sent

peer: 8blMQOY0CM9+6IOa+8fTvR61DEPvjvreaVcDM8gGPHc=
  endpoint: **.***.**.**:1135
  allowed ips: 10.9.0.8/32
  latest handshake: 2 hours, 9 minutes, 15 seconds ago
  transfer: 63.57 MiB received, 663.65 MiB sent

peer: dipPENq8fnxcbHQTRjozaJ9ArLzmIVvk9pME0orpEwI=
  endpoint: **.***.**.**:8242
  allowed ips: 10.9.0.6/32
  latest handshake: 5 hours, 22 seconds ago
  transfer: 483.36 MiB received, 15.40 GiB sent

peer: +EvaKBQMWz2e8qUJCGD/pQTtVAOFvI/NhYYetPjFlAw=
  allowed ips: 10.9.0.2/32

peer: X87RGbZR6ZFUFqb+94FyjhnoO6Il5oltT7U0sdh4eig=
  allowed ips: 10.9.0.9/32

peer: MPjVj+GKW85Qct/M0ADeXLyE8JcdyLAl4Dr7aMMUBDA=
  allowed ips: 10.9.0.12/32

peer: e2eUEwsJ7xfh5mPCNmqU0kT8zD7Hh6AWNVRM5NDQQwA=
  allowed ips: 10.9.0.13/32

peer: jPxjH4jnCJXSugDbwXkVMQxMqbUaB3CdEvc6Rz1aGWs=
  allowed ips: 10.9.0.14/32
10000:  from all fwmark 0x1 lookup 100
default dev awg1 scope link 
Number of entries: 8649

Я правильно понимаю, что проблема у меня не с входным сервером и не с его портом, а с тем что мне выходной айпишник требуется теперь менять?

**Reply by bivlked** [reply]
Степан, добрый день. Вы правы: вход исправен, обрыв дальше по цепочке. Менять адрес пока рано,
ниже объясню почему, а людям интернет можно вернуть прямо сейчас, одной командой.

## Вход исправен, молчит плечо к выходному серверу

Это видно по вашему же выводу, без догадок. На `awg0` рукопожатия свежие у многих клиентов, у
одного три секунды назад, и трафик идёт гигабайтами. Значит порт открыт, обфускация проходит,
клиенты до вас доезжают.

А на `awg1` последнее рукопожатие четырнадцать часов назад. Маршрут при этом на месте: в таблице
100 лежит `default dev awg1`, и всё помеченное уезжает туда. То есть пакеты исправно отдаются в
`awg1`, а вот через туннель уже не доставляются: ядро не смотрит на свежесть рукопожатия и в
обычную таблицу их не возвращает.

Схема эта ломается двумя способами, и симптомы у них противоположные. Пропади маршрут в таблице
100, помеченный трафик провалился бы в обычную таблицу и ушёл через ваш вход: интернет бы
работал, но заграничные сервисы видели бы российский адрес. У вас обратный случай, маршрут есть,
а за ним пусто, поэтому пакеты гибнут.

## Как вернуть клиентам интернет, пока выход лежит

Помеченный трафик можно отпустить через ваш вход, убрав ровно тот маршрут, который ведёт в
мёртвый туннель:

```bash
ip route del default dev awg1 table 100
```

Именно `del`, а не `flush`: сейчас в таблице один маршрут, но точечная команда не заденет то,
что окажется там потом. Когда подходящего маршрута в таблице не остаётся,
правило по метке не ошибается, а проваливается в обычную таблицу. Проверить:

```bash
ip route get 1.1.1.1 mark 0x1
```

Вместо `dev awg1` должен появиться ваш WAN. Клиенты пойдут в интернет через входной сервер: NAT
на внешнем интерфейсе установщик ставит при установке `awg0`, так что отдельно его настраивать
не придётся. Минус у обхода один и понятный: пока он включён, заграничные сервисы видят адрес
входа, то есть смысл каскада на это время теряется.

Делать это лучше, имея под рукой консоль хостера. Ваша ssh-сессия почти наверняка не
пострадает, но если исходящий трафик самого сервера у вас тоже метится, маршрут до вас может
поменяться, а проверить это по вашему выводу я не могу.

Вернуть, когда выход оживёт:

```bash
ip route replace default dev awg1 table 100
```

Имейте в виду, маршрут возвращается и сам: при следующем запуске `awg-routing` или после
перезагрузки.

## Пропало всё, а не только заграничное, из-за DNS

Российские адреса метку не получают и идут напрямую, так что российские сайты у клиентов должны
были остаться доступными. А они, судя по описанию, тоже не открываются.

Самое вероятное объяснение - DNS. По умолчанию установщик раздаёт клиентам `1.1.1.1` и
`1.0.0.1`, адреса зарубежные, поэтому запросы имён метятся наравне с прочим заграничным и
уезжают в мёртвый туннель. Имя не разрешается, не открывается ничего, включая то, до чего
маршрут жив.

Проверяется это с клиента за полминуты:

```bash
ping -c3 77.88.55.242
nslookup ya.ru 1.1.1.1
```

Если адрес отзывается, а имя не разрешается, объяснение верное. Если не отзывается и адрес,
дело шире, и тогда смотреть надо счётчики правил маркировки (`iptables -t mangle -vnL`), а не
DNS.

## «Менять адрес» - это три разных действия, и нужное пока не выбрано

Под сменой адреса скрываются три разные вещи: поправить `Endpoint`, если у машины сменился
адрес; поднять её, если она лежит; взять новый сервер, если прежний не восстановить. Первое
стоит минуту, третье - денег и переноса всех клиентов, а какое из них ваше, пока не понять.

Дешевле всего начать с этого:

```bash
systemctl restart awg-quick@awg1
sleep 20
awg show awg1
```

Оговорка, чтобы вы не удивились. Рестарт туннеля может потянуть за собой `awg-routing`, а тот
вернёт маршрут в таблицу 100, и интернет у клиентов снова пропадёт. У меня так на systemd 255, у
вас зависит от юнита, поэтому загляните после проверки в `ip route show table 100` и при нужде
повторите `del`.

Если рукопожатие так и не появилось, выходной сервер с вашего входа недоступен, и дальше это
выясняется уже в панели хостера. Просите у них не отчёт словами, а скриншот консоли: машина
бывает жива и загружена, а в консоль не пускают по правам, и со стороны это неотличимо от
зависшей загрузки. И посмотрите, не сменился ли у неё адрес после их перезапуска: тогда хватит
правки `Endpoint` в `awg1.conf`. Клиентские соединения при этом оборвутся и переустановятся,
это нормально.

И ещё, раз уж выкладываете вывод. Клиентские endpoint вы замаскировали, а адрес выходного
сервера оставили открытым: его публикация облегчает адресную блокировку, так что прятать стоит
и его.

**Comment by esmik92-ship-it** [comment]
Добрый день, выполнял всё по инструкции
https://github.com/bivlked/amneziawg-installer/blob/main/CASCADE.md#step1
проверки все выполнил, vpn поднимается, но у меня в 2ip высвечивается ip
выходного сервера, а не московского.

пн, 24 авг. 2026 г. в 15:31, Ivan Bondarev ***@***.***>:

> Добрый день. Уточните, что именно не работает: у каскада обычно ломается
> одно из трёх мест, и лечится каждое по-своему. Тред, в который вы написали,
> про одиночный сервер и отсутствие рукопожатия, так что ваш случай, скорее
> всего, другой.
>
> Чтобы не гонять вас лишний раз, вот все три с первой командой для каждого.
> Всё выполняется на входном сервере (Москва) под root. Имена интерфейсов и
> номер таблицы - как в моём гайде по каскаду; если собирали по своей схеме,
> подставьте свои.
>
>    1. Клиент не подключается вовсе, рукопожатия нет. Каскад тут ни при
>    чём, это обычная проблема входного сервера:
>
> awg show awg0
>
> Смотрите latest handshake у своего пира. Пусто - пакеты клиента до входа
> не доходят, и дело в порте, UFW или операторе.
>
>    2. Клиент подключился, а интернета нет совсем. Проверяйте дальнее
>    плечо и маршрут:
>
> awg show awg1
> ip route show table 100
>
> awg1 это туннель AmneziaWG до Амстердама, но живёт он на входном сервере.
> У первой команды должно быть свежее latest handshake, у второй - строка default
> dev awg1 scope link.
>
>    3. Интернет есть, но заграничные сайты видят российский адрес. Команда
>    та же, ip route show table 100, а случай самый обидный: снаружи всё
>    выглядит рабочим.
>
> Маршрут в эту таблицу кладёт только awg-routing.sh: в
> /etc/amnezia/amneziawg/awg1.conf стоит Table = off, и awg-quick сам
> ничего не прокладывает. Стоит awg1 разок опуститься, ядро сносит маршрут
> вместе с интерфейсом, а правило ip rule остаётся на месте. Обычно всё
> поднимается само, юнит awg-routing завязан на оба туннеля через Requires,
> но если интерфейс дёргали руками или после перезагрузки awg1 не встал,
> юнит не отработает и таблица останется пустой.
>
> Дальше я это отдельно проверял на стенде: *правило по метке при пустой
> таблице не ругается, а молча проваливается в основную таблицу*. Весь
> клиентский трафик уходит через WAN входного сервера, то есть с российского
> адреса. Туннели при этом живы, ipset на месте, в логах ни строки. Со
> стороны это выглядит как «VPN работает», просто заграничные сервисы видят
> Россию.
>
> Лечится одной командой:
>
> systemctl restart awg-routing
>
> Проверить с клиента: curl https://ifconfig.me должен показать адрес
> амстердамского сервера. Покажет московский - маршрута нет.
>
> Если разбираться некогда, выполните на входном вот это и пришлите вывод,
> по нему видно почти всё сразу (строку endpoint можно замазать, там ваш
> домашний адрес):
>
> awg show; ip rule show | grep fwmark; ip route show table 100; ipset list ru | grep Number
>
> Остальные случаи разобраны в диагностике гайда:
> https://github.com/bivlked/amneziawg-installer/blob/main/CASCADE.md#trouble
>
> —
> Reply to this email directly, view it on GitHub
> <https://github.com/bivlked/amneziawg-installer/discussions/153?email_source=notifications&email_token=B7RFI2EC6EFHBSAARVF3VNL5LQYQVA5CNFSNUABIM5UWIORPF5TWS5BNNB2WEL2ENFZWG5LTONUW63SDN5WW2ZLOOQXTCOBRGM2DQMJVUZZGKYLTN5XKOY3PNVWWK3TUUVSXMZLOOSWGM33PORSXEX3DNRUWG2Y#discussioncomment-18134815>,
> or unsubscribe
> <https://github.com/notifications/unsubscribe-auth/B7RFI2B5MBWR4NKSOX4J6A35LQYQVAVCNFSNUABIKJSXA33TNF2G64TZHM4TMNJWGM4TSMZSHNCGS43DOVZXG2LPNY5TCMBTGUYDMNJTUF3AE>
> .
> Triage notifications, keep track of coding agent tasks and review pull
> requests on the go with GitHub Mobile for iOS
> <https://github.com/notifications/mobile/ios/B7RFI2EUMJ2VM6LRR546QI35LQYQVA5CNFSNUABIM5UWIORPF5TWS5BNNB2WEL2ENFZWG5LTONUW63SDN5WW2ZLOOQXTCOBRGM2DQMJVUZZGKYLTN5XKOY3PNVWWK3TUUVSXMZLOOSVGM33PORSXEX3JN5ZQ>
> and Android
> <https://github.com/notifications/mobile/android/B7RFI2H6LPMQOSBYRZQOR3L5LQYQVA5CNFSNUABIM5UWIORPF5TWS5BNNB2WEL2ENFZWG5LTONUW63SDN5WW2ZLOOQXTCOBRGM2DQMJVUZZGKYLTN5XKOY3PNVWWK3TUUVSXMZLOOSXGM33PORSXEX3BNZSHE33JMQ>.
> Download it today!
> You are receiving this because you commented.Message ID:
> ***@***.***
> .com>
>


-- 

С уважением,

                Павлов Степан




Email: ***@***.*** ***@***.***>com

**Reply by bivlked** [reply]
Степан, добрый день. Возвращаюсь к вашему вопросу от 28 августа про адреса: он потерялся у меня
между остальными сообщениями, извините.

Тут всё правильно, так каскад и работает. Деление идёт по адресу назначения, а не по домену:
список российских сетей берётся из зоны ipdeny и лежит на входном сервере в наборе `ru`. Что
попало в список, уходит напрямую с московского сервера, и сайт видит московский адрес. Остальное
метится и едет в туннель до Амстердама. Схема целиком - в
[«Как это работает»](https://github.com/bivlked/amneziawg-installer/blob/main/CASCADE.md#how).

Поэтому обе ваши картинки верны одновременно. Яндекс живёт в российских сетях и показывает
Москву. А адрес, на который у вас разрешается 2ip, в список не попал, поэтому туда вы вышли из
Амстердама. Зона `.ru` тут ни при чём, значение имеет только адрес.

Проверить любой сайт можно на входном сервере:

```bash
getent ahostsv4 2ip.ru | awk 'NR==1{print $1}'
ipset test ru АДРЕС_ИЗ_ПЕРВОЙ_КОМАНДЫ
```

`is in set ru` значит, что выйдете из Москвы, `is NOT in set` - из Амстердама. У положительного
ответа ipset ставит впереди слово `Warning:` - это не ошибка, просто такой у него вывод. И учтите,
что у сайтов за CDN адрес в разных местах разный, так что для них проверка приблизительная.

Заодно это готовая диагностика: три состояния каскада различаются как раз по адресам.

- Разные сайты показывают то Москву, то Амстердам - нормальная работа. Ваш случай 28 августа
  именно такой, и он же доказывает, что живы обе половины: будь список пуст, Яндекс тоже ушёл бы
  в Амстердам, а пропади маршрут в туннель - 2ip показал бы Москву.
- Все показывают Москву - пропал маршрут в таблице 100, помеченный трафик перестал уходить в
  туннель.
- Не открывается ничего - лежит плечо до выхода. Это ваш случай от 6 сентября.

Кстати о нём: помогла ли команда, которую я тогда приводил, и поднялось ли плечо до Амстердама?
Если так и лежит, пришлите `awg show awg1` с входного сервера, посмотрим дальше.

**Comment by esmik92-ship-it** [comment]
НО!!! я только сейчас проверил, яндекс интернетометр показывает московский
IP


пт, 28 авг. 2026 г. в 15:48, Степан Павлов ***@***.***>:

**Reply by bivlked** [reply]
Это про тот же вопрос, ответил выше отдельным сообщением: обе картинки верны, деление идёт по адресу назначения.

**Comment by esmik92-ship-it** [comment]
Но это всё не особо важно, важно то, что у меня всё работает только с
домашним вай фаем или любым другим вайфаем. С мегафоном я не могу
подключиться. Подскажите куда копать дальше или какие конфиги прислать


пт, 28 авг. 2026 г. в 15:49, Степан Павлов ***@***.***>:

**Reply by bivlked** [reply]
Про Мегафон отвечал 28 августа отдельным сообщением в этой теме: там про порт и замер через tcpdump.

**Comment by bivlked** [comment]
Степан, добрый день. Похоже на порт, а не на обфускацию и не на каскад.

По умолчанию сервер слушает `39743/udp`. Часть операторов такой нестандартный высокий UDP просто глушит, а `443/udp` пропускает стабильно, потому что он неотличим от обычного QUIC. У меня это измерено на МТС: на дефолтном порту связи нет вообще, на 443 туннель поднимается и работает; то же самое независимо подтвердил другой пользователь. У вас Мегафон, но механика та же, и симптом «на любом Wi-Fi работает, на сотовом не подключается» ровно этот.

Сразу оговорка, на которой легко потерять вечер: `--preset=mobile` здесь не помогает. Он меняет маскировку трафика, а порт оставляет прежним.

И уточните на всякий случай, что значит «не подключается»: рукопожатия нет вовсе или туннель поднимается, а трафик в нём не идёт. Ниже я исхожу из первого. Второе лечится совсем иначе, и тогда порт трогать не надо.

Прежде чем лезть на сервер, есть одна бесплатная проверка. На сотовом туннель часто не цепляется сразу после переключения с Wi-Fi: у оператора CGNAT переназначает UDP-сессию, а телефон рвёт старую. Мгновенное переключение тумблера обычно не спасает. Выключите Wi-Fi, подождите минуту или включите и выключите режим полёта, и только потом подключайтесь. Если поднялось, дальше можно не читать.

### Замер, чтобы не менять порт вслепую

Смена порта потребует перевыпустить конфиги и заново импортировать их на все устройства, поэтому сначала стоит убедиться, что пакеты от телефона до сервера вообще не доходят.

Всё делается на **московском** сервере, к которому подключаются клиенты. Амстердамский трогать не нужно, туннель между серверами тут ни при чём.

```
sudo grep ListenPort /etc/amnezia/amneziawg/awg0.conf
sudo apt-get install -y tcpdump
sudo tcpdump -ni any udp port 39743
```

Первая команда покажет ваш порт, его и подставьте в третью вместо 39743. `tcpdump` установщик не ставит, поэтому вторая строка на всякий случай.

Дальше команда будет молча висеть, так и надо. **Не закрывая её**, возьмите телефон, выключите Wi-Fi, дождитесь сотовой сети и попробуйте подключиться. Секунд через тридцать остановите дамп через Ctrl+C.

Порядок тут важнее самой команды. Пустой дамп сам по себе не значит ничего: если снять его тогда, когда телефон не стучится, ноль пакетов будет и на совершенно здоровой сети. Смысл появляется, только когда дамп идёт одновременно с реальной попыткой.

**Если пакеты пошли** - порт живой, причина глубже, и тогда мне нужны подробности, они в самом конце.

**Если пакетов нет вообще** - до сервера трафик не доходит. Это либо порт, либо сам адрес сервера, и различить их можно одним действием: с того же телефона на сотовой сети попробуйте зайти на московский сервер по SSH. Отвечает SSH, а VPN нет - адрес доступен, значит режут либо конкретный порт, либо UDP вообще; и то и другое чаще всего лечится переездом на 443, потому что этот порт операторы пропускают как обычный QUIC. Не отвечает вообще ничего, хотя с Wi-Fi отвечает - у оператора закрыт сам адрес, и тогда порт менять бесполезно, нужен другой IP.

### Смена порта на 443

```
sudo sed -i 's/^ListenPort = .*/ListenPort = 443/' /etc/amnezia/amneziawg/awg0.conf
sudo sed -i 's/^export AWG_PORT=.*/export AWG_PORT=443/' /root/awg/awgsetup_cfg.init
sudo ufw allow 443/udp
sudo systemctl restart awg-quick@awg0
```

Затем перевыпустите каждый конфиг, чтобы в `Endpoint` встал новый порт, и заново импортируйте их на устройства. Старые работать не будут, в них зашит прежний порт.

```
sudo bash /root/awg/manage_amneziawg.sh regen ИМЯ_КЛИЕНТА
```

Порт 443 нормально проходит и на домашних сетях, так что переводить на него можно все устройства сразу, отдельный мобильный конфиг держать незачем. Переустановка с флагом `--mobile` тоже поставит 443, но заодно перегенерирует весь набор параметров обфускации, и переимпортировать придётся вообще всё; четыре команды выше делают то же самое точечно.

Весь разбор с обоснованием лежит в [ADVANCED.md, раздел про MTU и мобильные клиенты](https://github.com/bivlked/amneziawg-installer/blob/main/ADVANCED.md#mtu-mobile-adv), подраздел «Сотовый оператор режет порт».

### Если порт ни при чём

Пришлите тогда, пожалуйста, три вещи: несколько строк из `tcpdump` за время попытки, каким приложением подключаетесь и его версию (`amneziawg-android`, AmneziaVPN или другое), и версию установщика:

```
sudo grep 'НАЧАЛО УСТАНОВКИ' /root/awg/install_amneziawg.log | tail -1
```

Про 2ip и Яндекс отвечу заодно, раз вы сами на это наткнулись. Каскад делит трафик по диапазонам адресов, а не по доменам: что попало в список российских сетей, уходит напрямую с московского входа, остальное через Амстердам. Московский адрес у Яндекса как раз и доказывает, что деление работает. А 2ip показал амстердамский потому, что его адрес в списке не числится: имя у сайта российское, а сервер может стоять где угодно, хоть на зарубежном CDN. Если хочется, чтобы и такие сайты шли напрямую, список обновляется по инструкции: [CASCADE.md, обновление списка российских сетей](https://github.com/bivlked/amneziawg-installer/blob/main/CASCADE.md#update).

**Comment by esmik92-ship-it** [comment]
Спасибо большое.
Порт по умолчанию я при установке задал другой, но не 443

Но до того как вы ответили, я немного с дипсиком пообщался еще и изменил
вот эти параметры в  /etc/amnezia/amneziawg/awg0.conf
Jmin=40, Jmax=100
Какое то время у меня поработало, но не долго, далее я изменил
 I1 = <r 64>

Сейчас все работает


При установке я так же использовал  --preset=mobile

По поводу смены порта учту если снова упадёт.

Отдельное спасибо за то что подсказали как сменить порт без переустановки.


На всякий случай уточню, если мне опять айпишник блокнут, я могу как то
весь конфиг перенести на другой сервак и там каким то образом заменить в
настройках только айпишник и не переустанавливать все по новой, особенно
клиентов.

Если возможно, не подскажете как это максимально быстро реализовать?

Ещё раз спасибо большое за обратную связь.


С уважением,

                Павлов Степан




Email: ***@***.*** ***@***.***>com


пт, 28 авг. 2026 г., 18:35 Ivan Bondarev ***@***.***>:

**Reply by bivlked** [reply]
Отвечал в соседней ветке 28 и 31 августа: помог именно меньший I1, плюс про endpoint и повторную установку с --preset.

**Comment by esmik92-ship-it** [comment]
Совсем забыл, что хотел уточнить. Вот у меня например стоит клиент
amneziavpn , там я дополнительно настроил туннелирование приложений. Но
каждому клиенту это делать, это запара. Можно ли сразу как то это на
сервере сделать?

С уважением,

                Павлов Степан




Email: ***@***.*** ***@***.***>com

пт, 28 авг. 2026 г., 21:24 Степан Павлов ***@***.***>:

**Reply by bivlked** [reply]
Хорошо, что заработало. Но уточню одну вещь про то, что именно помогло, иначе в следующий раз вы примените то же лекарство, а оно может не сработать.

## Что из ваших правок могло подействовать, а что нет

Вы поменяли `Jmin`, `Jmax` и `I1` в серверном конфиге. Вопрос один: перевыпускали ли вы после этого клиентские конфиги и переносили ли их заново на телефон?

Если не перевыпускали, то до телефона ваши правки не доехали. `I1` отправляет только та сторона, которая начинает рукопожатие, а начинает его всегда клиент. То есть оператор видит `I1` вашего телефона, а не сервера. Мусорные пакеты `Jc`, `Jmin` и `Jmax` тоже уходят от инициатора. Значит починило что-то другое, и я бы держал в уме порт.

А если перевыпускали, тогда всё сходится. Генератор ставит `I1` случайного размера от 32 до 256 байт, и у вас мог оказаться крупный. `<r 64>` заметно меньше, а на операторе, который режет большие UDP, это может решать.

Проверяется за секунду: посмотрите строку `I1` в конфиге на телефоне. Стоит `<r 64>` - значит перевыпускали, и объяснение первое. Стоит другое значение - значит помогло что-то иное.

Сами правки, кстати, безопасны. `I1` не обязан совпадать у сервера и клиента, поэтому рассинхрон здесь ничего не ломает. А вот `S1`-`S4` совпадать обязаны, их не трогайте.

## Если адрес заблокируют

Перенести можно целиком, и заводить клиентов заново не придётся. На старом сервере:

```
sudo bash /root/awg/manage_amneziawg.sh backup
```

Заберите архив **на свой компьютер**, а не оставляйте на сервере, который вы, возможно, теряете:

```
scp root@СТАРЫЙ_АДРЕС:/root/awg/backups/*.tar.gz .
```

На новом сервере ставите ту же версию установщика, копируете архив обратно и восстанавливаетесь:

```
sudo bash /root/awg/manage_amneziawg.sh restore ИМЯ_АРХИВА.tar.gz
```

Ключи сервера, список клиентов и параметры обфускации при этом сохраняются. Меняется только адрес, поэтому клиентам нужно обновить `Endpoint`:

```
sudo bash /root/awg/manage_amneziawg.sh regen ИМЯ_КЛИЕНТА
```

Ключи клиента `regen` не трогает, я это проверял: приватный ключ до и после совпадает. Так что заново заводить никого не нужно, достаточно перенести обновлённый файл на устройство.

Если клиентов немного, есть путь ещё короче: не перевыпускать вообще, а поправить строку `Endpoint` прямо в приложении на каждом устройстве. Результат тот же, а возиться с переносом файлов не придётся.

**Одна ловушка, проверьте её до перевыпуска:**

```
grep AWG_ENDPOINT /root/awg/awgsetup_cfg.init
```

Если значение пустое, а это обычный случай, адрес определится сам и всё сработает. Если там прописан старый IP, а так бывает при установке с `--endpoint=`, то `regen` молча вернёт в конфиги мёртвый адрес. Тогда сначала поправьте эту строку, потом перевыпускайте.

И деталь, которая у вас важна из-за каскада: всё сказанное касается **московского** сервера, к которому подключаются люди. Если адрес сменится у амстердамского, клиентов трогать не нужно вообще, там правится только конфиг туннеля между серверами.

Сам перенос между серверами я на стенде не гонял, `backup` и `restore` проверял на одной машине. Механика прямая, но если решитесь, лучше сначала на запасном сервере, а не на живом.

## Раздельное туннелирование на сервере

Не получится, и не из-за недоделки. Сервер видит IP-пакеты, а не приложения: в пакете нет ничего, что говорило бы, какая программа его отправила. Эту информацию знает только сама операционная система телефона, поэтому разбивка по приложениям и живёт в клиенте.

Единственный серверный рычаг близкого смысла это `AllowedIPs` в клиентском конфиге, но он делит трафик **по адресам назначения**, а не по программам. Задать «телеграм через VPN, остальное мимо» так нельзя: адреса телеграма меняются, а половина приложений ходит в те же облака, что и всё остальное.

И ещё одно, раз вы говорите про несколько человек. Даже будь такая возможность на сервере, вам всё равно не пришлось бы делать это за них: каждый настраивает список приложений у себя один раз, минуты за две. Так что «запара» тут разовая и не ваша, достаточно один раз показать людям, где в приложении лежит этот список.

**Comment by esmik92-ship-it** [comment]
Да, клиентский конфиг соответственно перевыпускал и переносил на телефон.

За ловушку с айпи опять же спасибо, т.к. при установке я задавал endpoint

Спасибо ещё раз за помощь!


С уважением,

                Павлов Степан




Email: ***@***.*** ***@***.***>com

Тел.: 8-921-630-60-45

пт, 28 авг. 2026 г., 21:55 Ivan Bondarev ***@***.***>:

**Reply by bivlked** [reply]
Степан, спасибо, оба уточнения важные, отвечу коротко и на этом закроем.

Раз конфиги вы перевыпускали и переносили, картина сходится: помог именно
меньший `I1`. Установщик ставит случайный размер от 32 до 256 байт, вам достался
крупный, а `<r 64>` заметно короче - и на операторе, который режет большие
UDP-пакеты, этого хватило. Значит порт у вас ни при чём, и держать его в голове
как подозреваемого больше не нужно.

Теперь про endpoint, раз вы его при установке задавали. Тогда при переезде на
новый сервер эта строка вас точно укусит, и молча. Смотрим, что там лежит:

```
grep AWG_ENDPOINT /root/awg/awgsetup_cfg.init
```

Если увидите там старый адрес, замените его **до** того, как будете
перевыпускать конфиги:

```
sudo sed -i "s|^export AWG_ENDPOINT=.*|export AWG_ENDPOINT='НОВЫЙ_АДРЕС'|" /root/awg/awgsetup_cfg.init
```

Иначе `regen` разложит по конфигам адрес сервера, которого у вас уже нет, и
никакой ошибки при этом не покажет - просто не подключится. Если новый адрес
заранее неизвестен, можно оставить пустые кавычки, тогда установщик определит
его сам.

Ещё одно, на будущее, и оно важнее всего сказанного выше. Вы ставили сервер с
`--preset=mobile`. Если когда-нибудь запустите установку повторно с этим же
флагом, он перегенерирует не только ваш `I1`, а весь набор обфускации разом:
`Jc`, `Jmin`, `Jmax`, `S1`-`S4`, `H1`-`H4`. А `S` и `H` обязаны совпадать у
сервера и клиента, так что после этого перестанут подключаться все ваши
устройства, пока не перевыпустите им конфиги. Установщик предупреждает об этом
в журнале, но строчки легко проскочить.

Так что переустанавливать лучше без `--preset`. А если всё-таки с ним, то сразу
закладывайтесь на `regen` для всех.

И совсем не по теме: вы отвечаете почтой, и подпись из письма приходит сюда
целиком, вместе с номером телефона. Тред открыт для поиска. Если не хотели -
сообщения можно поправить через веб-интерфейс. Текст ваш, сам я туда не лезу,
просто обращаю внимание.

Удачи, и пишите, если что-то ещё вылезет.
